{"allowed_client":"127.0.0.1","allowed_uid":10001,"command_port":20003,"dds_domain_id":41,"gpu_index":0,"image_digest":"sha256:dddddddddddddddddddddddddddddddddddddddddddddddddddddddddddddddd","ipc_mode":"private","layout_sha256":"cccccccccccccccccccccccccccccccccccccccccccccccccccccccccccccccc","logical_host":"fixture-host","network_mode":"none","publisher_hz":30,"publisher_port":20002,"reset_snapshot_sha256":"bbbbbbbbbbbbbbbbbbbbbbbbbbbbbbbbbbbbbbbbbbbbbbbbbbbbbbbbbbbbbbbb","ros_domain_id":null,"scene_sha256":"aaaaaaaaaaaaaaaaaaaaaaaaaaaaaaaaaaaaaaaaaaaaaaaaaaaaaaaaaaaaaaaa","source_revision":"eeeeeeeeeeeeeeeeeeeeeeeeeeeeeeeeeeeeeeee","station_id":"engineering-1","unitree_dds_enabled":false,"version":1}
